Page ascore,Source title,Source url,Target url,Anchor,External links,Internal links,Nofollow,Sponsored,Ugc,Text,Frame,Form,Image,Sitewide,First seen,Last seen,New link,Lost link
5,Preparing for a New Homeschool Year - Molly Green,https://mollygreen.com/blog/preparing-for-a-new-homeschool-year/,http://www.aswewalkalongtheroad.com/,As We Walk Along the Road.,1,66,False,False,False,True,False,False,False,False,2024-01-31,2025-03-16,False,False
24,As We Walk Along the Road (leah_courtney) - Profile | Pinterest,https://ru.pinterest.com/leah_courtney/,http://www.aswewalkalongtheroad.com/,aswewalkalongtheroad.com ; Opens a new tab,1,15,False,False,False,True,False,False,False,False,2023-09-12,2025-04-19,False,False
6,How to Manage Homeschooling Multiple Ages…Whatever Your Homeschooling Style – iHomeschool Network,https://ihomeschoolnetwork.com/homeschooling-multiple-ages-methods/,https://www.aswewalkalongtheroad.com/,www.aswewalkalongtheroad.com/,1,39,False,False,False,True,False,False,False,False,2025-02-27,2025-04-30,False,False
11,Literature-based unit studies,https://as-we-walk-along-the-road.ck.page/bd60fc8417,https://www.aswewalkalongtheroad.com/p/as-we-walk-shop-terms-and-conditions.html,Terms and Conditions,4,0,False,False,False,True,False,False,False,False,2023-12-07,2024-11-05,False,True
8,A Folk Song a Week | Music in Our Homeschool,https://learn.musicinourhomeschool.com/p/a-folk-song-a-week,https://www.aswewalkalongtheroad.com/,As We Walk Along the Road,5,51,False,False,False,True,False,False,False,False,2024-01-21,2025-05-13,False,False
7,4 Tips for All-Ages Family Prayer,https://whatsinthebible.com/4-tips-all-ages-family-prayer/,http://www.aswewalkalongtheroad.com/,As We Walk Along the Road.,6,32,False,False,False,True,False,False,False,False,2024-01-16,2025-05-15,False,False
5,The Gold Book - Literary Criticism - High School Skills,https://www.commonsensepress.com/store/p222/the-gold-book-literary-criticism-high-school-skills-ebook.html,https://www.aswewalkalongtheroad.com/3-reasons-to-include-literary-criticism/,review,6,100,False,False,False,True,False,False,False,False,2024-10-10,2025-03-30,False,False
5,Little House on the Prairie Unit Study Resources with FREE Printable Lapbooks,https://homeschoolgiveaways.com/little-house-on-the-prairie-unit-study-resources-with-free-printable-lapbooks/,http://www.aswewalkalongtheroad.com/2017/02/little-house-on-prairie-literature-unit.html,littlehouse littlehouse,6,57,False,False,False,False,False,False,True,False,2023-10-11,2024-11-27,False,True
6,Homeschooling « Susan's Homeschool Blog,http://blog.susanevans.org/tag/homeschoolingggggggggg/page/56/?article=159,http://www.aswewalkalongtheroad.com/2015/08/introducing-your-children-to.html,Introducing Your Children to Shakespeare,9,82,False,False,False,True,False,False,False,False,2024-06-19,2025-02-05,False,False
5,How Getting Messy Will Benefit Your Homeschool - Ben and Me,https://www.benandme.com/delight-directed-learning-getting-messy/,http://www.aswewalkalongtheroad.com/,As We Walk Along the Road.,9,37,False,False,False,True,False,False,False,False,2024-08-20,2025-05-07,False,False
5,How to Homeschool Multiple Ages – The Learning Hypothesis,https://learninghypothesis.com/how-to-homeschool-multiple-ages/,https://resources.aswewalkalongtheroad.com/FreeLiteratureResources,Free ebook of Unit Studies,11,62,False,False,False,True,False,False,False,False,2024-10-26,2025-04-29,False,False
11,Apple Graphing with Apple Farmer Annie - Teach Beside Me,https://teachbesideme.com/apple-graphing-with-apple-farmer-annie/,http://aswewalkalongtheroad.com/,As We Walk Along the Road,11,53,False,False,False,True,False,False,False,False,2024-10-19,2025-05-07,False,False
5,"Culture Shock in Colonial America, Sign of the Beaver book club - Adventures in a Messy Life",https://ticiamessing.com/sign-of-the-beaver-book-club/,https://www.aswewalkalongtheroad.com/2015/06/read-aloud-wednesdays-book-feature-sign.html?m=1&showComment=1433456267696,As does As We Walk Along the Road,11,45,False,False,False,True,False,False,False,False,2023-12-18,2025-05-07,False,True
7,Balancing Magic! Inspired by Dr. Seuss Books | KidMinds,https://kidminds.org/dr-seuss-inspired-center-of-gravity-experiments/,https://www.aswewalkalongtheroad.com/2020/01/Dr-Seuss-activities.html,Dr. Seuss Activities for Favorite Dr. Seuss Books,13,178,False,False,False,True,False,False,False,False,2023-05-09,2024-12-07,False,False
9,"Rhythm of Handwriting : A sensory approach to fluid, legible handwriting | Modulo",https://www.modulo.app/all-resources/rhythmofhandwriting2,https://www.aswewalkalongtheroad.com/2013/09/review-of-rhythm-of-handwriting-from.html,https://www.aswewalkalongtheroad.com/2013/09/review-of-rhythm-of-handwriting-from.html,13,23,False,False,False,True,False,False,False,False,2022-08-07,2025-04-22,False,False
14,Music Appreciation of the Romantic Era for High School | Music in Our,https://music-in-our-homeschool.teachable.com/p/music-appreciation-of-the-romantic-era-for-high-school,http://www.aswewalkalongtheroad.com/,As We Walk Along the Road,14,51,False,False,False,True,False,False,False,False,2025-04-19,2025-05-02,True,False
6,Simple Steps to Creating Your Own Homeschool Unit Studies (+ Free Printable) - Proverbial Homemaker,https://www.proverbialhomemaker.com/simple-steps-creating-homeschool-unit-studies.html,http://www.aswewalkalongtheroad.com/2015/10/31-days-of-literature-unit-study-ideas.html,including this series of thirty-one unit studies based on great kids’ literature.,14,76,False,False,False,True,False,False,False,False,2023-05-19,2025-05-10,False,False
5,How to Homeschool in the Midst of Having a New Baby,https://www.hidethechocolate.com/homeschool-in-the-midst-of-having-a-new-baby/,https://www.aswewalkalongtheroad.com/,As We Walk Along the Road,15,42,False,False,False,True,False,False,False,False,2024-08-15,2025-05-15,False,False
6,Oswiu | Kregel,https://www.kregel.com/blogtours/books-on-tour/oswiu,http://www.aswewalkalongtheroad.com/2017/01/review-of-oswiu-king-of-kings.html,Leah Courtney,15,46,False,False,False,True,False,False,False,False,2024-12-21,2025-05-09,False,False
6,Six Ways to Make Your Homeschool Co-op Days Run Smoothly,https://encouragingmomsathome.com/six-ways-make-homeschool-co-op-days-run-smoothly/,https://www.aswewalkalongtheroad.com/2016/01/should-i-join-homeschool-co-op-look-at.html,here are some things to consider.,16,66,False,False,False,True,False,False,False,False,2023-07-03,2025-05-05,False,True
7,Homeschool Planning- Three Methoods to Get it Done {Guest Post} - Only Passionate Curiosity,https://onlypassionatecuriosity.com/homeschool-planning-three-methoods-to-get-it-done-guest-post/,http://www.aswewalkalongtheroad.com/,As We Walk Along the Road.,16,64,False,False,False,True,False,False,False,False,2023-08-18,2024-11-30,False,True
7,How to Host a Summer Book Club for Kids: Charlotte's Web - Overstuffed Life,https://www.overstuffedlife.com/how-to-host-summer-book-club-for-kids/,https://www.aswewalkalongtheroad.com/free-literature-unit-study-ideas-for/,Charlotte’s Web Literature Unit Ideas,16,79,False,False,False,True,False,False,False,False,2024-07-25,2025-05-08,False,False
5,How to Revive Your Homeschool in a Winter Slump - Heart and Soul Homeschooling,https://heartandsoulhomeschooling.com/homeschool-winter-slump/,https://www.aswewalkalongtheroad.com/2016/06/create-your-own-unit-study.html,you can get a free step-by-step unit study planner here.,17,40,False,False,False,True,False,False,False,False,2024-12-30,2025-05-02,False,False
6,IntenseDebate - mwfinchwren,https://www.intensedebate.com/profiles/mwfinchwren,http://www.aswewalkalongtheroad.com/,As We Walk Along the Road,18,11,False,False,False,True,False,False,False,False,2024-09-15,2025-04-08,False,False
5,Owl Unit Study for Kids - Owl Theme Lesson Plan Ideas - Simple Living Mama,https://simplelivingmama.com/owl-unit-study-for-kids/,http://www.aswewalkalongtheroad.com/2016/10/literature-unit-study-for-owl-moon-by.html,Owl Moon Literature Study,19,82,False,False,False,True,False,False,False,False,2024-08-26,2025-05-06,False,False
5,Creative Skills For Kids To Explore — That Bald Chick®,https://thatbaldchick.com/creative-skills-for-kids-to-explore/,https://www.aswewalkalongtheroad.com/poetry-resources-for-your-homeschool/,poetry,20,72,False,False,False,True,False,False,False,False,2024-04-01,2025-05-05,False,False
14,About — Sunnu Rebecca Choi - Illustrator,https://www.bysunnu.com/about,https://www.aswewalkalongtheroad.com/2022/11/learn-geography-through-food.html,As We Walk Along The Road,20,8,False,False,False,True,False,False,False,False,2024-03-23,2025-05-16,False,False
6,Early Chapter Books,https://sloely.com/early-chapter-books/,http://www.aswewalkalongtheroad.com/2016/03/great-first-chapter-books-series-for.html,As We Walk Along the Road,21,38,False,False,False,True,False,False,False,False,2024-01-26,2025-05-16,False,False
5,15 Ways to Homeschool Through the Holidays - Southeast Homeschool Expo,https://www.southeasthomeschoolexpo.com/homeschool-through-the-holidays/,http://www.aswewalkalongtheroad.com/2017/11/homeschooling-through-the-holidays.html,5 Simple Ideas for Homeschooling Through the Holidays,23,78,False,False,False,True,False,False,False,False,2024-08-19,2025-04-29,False,False
10,Fox Theatre for Families at Home | Fox Tucson Theatre,https://foxtucson.com/kitt/kit-online/online/,https://www.aswewalkalongtheroad.com/2015/10/literature-unit-study-ideas-for-it.html,Lessons and Study Ideas,23,169,False,False,False,True,False,False,False,False,2024-01-23,2025-05-11,False,False
10,,https://gominno.com/blog/how-to-keep-a-summer-routine-with-kids/,http://www.aswewalkalongtheroad.com/,As We Walk Along the Road,23,30,False,False,False,True,False,False,False,False,2024-10-20,2025-04-08,False,False
7,Dr. Seuss Crafts for Kids of All Ages - That Kids' Craft Site,https://thatkidscraftsite.com/dr-seuss-crafts/,https://www.aswewalkalongtheroad.com/2020/01/Dr-Seuss-activities.html,Favorite Dr. Seuss Activities for Kids from As We Walk Along the Road,24,35,False,False,False,True,False,False,False,False,2023-07-13,2025-05-16,False,False
9,The First 5 Children's Authors Your Child Should Know | Home Educators Association Of Virginia,https://heav.org/best-childrens-authors/,https://www.aswewalkalongtheroad.com/2018/01/favorite-children-book-author-tomie-de.html,unit study activities,24,134,False,False,False,True,False,False,False,False,2023-08-04,2025-04-21,False,False
12,15 Creative Road Trip Activities + Ideas Kids Activities Blog,https://kidsactivitiesblog.com/15011/creative-road-trip-activities/,http://www.aswewalkalongtheroad.com/2016/04/10-great-book-series-for-middle-grade.html,10 Great Book Series for Middle Grade and High School,25,144,False,False,False,True,False,False,False,False,2022-12-24,2025-01-04,False,False
5,Introducing Measurement with Dr. Seuss' The Foot Book,https://homeschoolinginprogress.com/dr-seuss-foot-book/,https://www.aswewalkalongtheroad.com/2020/01/Dr-Seuss-activities.html,Dr. Seuss Activities for Favorite Dr. Seuss Books,26,28,False,False,False,True,False,False,False,False,2024-04-06,2025-02-08,False,False
7,Life Skills and Homeschooling Go Hand in Hand - Day By Day in Our World,https://daybydayinourworld.com/life-skills-and-homeschooling-go-hand-in-hand/,http://aswewalkalongtheroad.com/,As We Walk Along the Road,27,70,False,False,False,True,False,False,False,False,2024-03-20,2025-05-09,False,False
5,Good Summer Books to Read - The Natural Homeschool,https://www.thenaturalhomeschool.com/good-summer-books-to-read.html,http://www.aswewalkalongtheroad.com/2016/05/10-great-living-books-for-early.html,10 Great Living Books,27,501,False,False,False,True,False,False,False,False,2024-07-20,2025-05-15,False,False
7,Through the Calm and Through the Storm: Making High School Plans,http://throughthecalmandthroughthestorm.blogspot.com/2015/06/making-high-school-plans.html,http://www.aswewalkalongtheroad.com/2015/06/making-plans-for-homeschooling-through.html,Making Plans for Homeschooling Through High School,28,21,False,False,False,True,False,False,False,False,2025-05-18,2025-05-18,True,False
5,15 Creative Put Me in the Zoo Activities for Preschoolers,https://homeschoolpreschool.net/put-me-in-the-zoo-activities/,https://www.aswewalkalongtheroad.com/2016/10/prek-k-unit-study-for-put-me-in-zoo.html,Pre-K Unit Study for Put Me in the Zoo -,28,51,False,False,False,True,False,False,False,False,2024-01-11,2025-04-04,False,True
16,You Can Do It! Homeschooling Through High School Blog Hop! – Golden Grasses,https://goldengrasses.home.blog/2015/06/03/you-can-do-it-homeschooling-through-high-school-blog-hop/,http://www.aswewalkalongtheroad.com/2015/06/are-you-really-homeschooling-through.html,As We Walk Along the Road,28,16,False,False,False,True,False,False,False,False,2021-09-02,2025-04-03,False,False
5,5 Tips for Managing Multiple Ages in Your Homeschool - My Joy-Filled Life,https://www.myjoyfilledlife.com/multiple-ages-in-your-homeschool/,https://www.aswewalkalongtheroad.com/,As We Walk Along the Road,29,85,False,False,False,True,False,False,False,False,2024-03-03,2025-05-14,False,False
5,101 Reasons You'll Never Regret Homeschooling (Even When People Say You're Crazy for Doing It) • Table Life Blog,https://tablelifeblog.com/regret-homeschooling/,https://www.aswewalkalongtheroad.com/2016/01/homeschooling-multiple-ages-together.html,"“Kids can learn more from teaching what they know. When we’ve read together and done learning activities together, the older kids get the opportunity to help younger kids learn, and this helps them to understand what they’re learning even better.”",32,29,False,False,False,True,False,False,False,False,2024-10-18,2025-05-07,False,False
8,12 Back-to-School Tips That Make an Impact for Your Homeschool,https://writeshop.com/blog/back-to-school-tips-homeschool/,https://www.aswewalkalongtheroad.com/,"Back-to-school tips from Leah Courtney, owner of aswewalkalongtheroad.com homeschooling 15 years, mom to 4 Back-to-school tips from Leah Courtney, owner of aswewalkalongtheroad.com homeschooling 15 years, mom to 4",34,59,False,False,False,False,False,False,True,False,2024-11-07,2025-04-30,False,False
5,High School Electives for Homeschool | True North Academy,https://truenorthhomeschool.academy/high-school-electives-for-homeschool/,http://www.aswewalkalongtheroad.com/2015/07/choosing-electives-for-homeschooling.html,Choosing Electives for Homeschooling High School,34,49,False,False,False,True,False,False,False,False,2024-10-31,2025-04-26,False,False
5,Homeschool Methods - 8 Tips for the Journey - Sunrise to Sunset,https://sunrisetosunsethomeschool.com/2018/01/15/homeschool-methods-8-tips-journey/,https://www.aswewalkalongtheroad.com/2018/01/homeschool-day-in-the-life.html,A Day in the Life of a Homeschooler: Expectation Vs. Reality,35,28,False,False,False,True,False,False,False,False,2024-01-08,2025-05-13,False,False
6,Christmas Activities - Add some holiday fun to your homeschool! - StartsAtEight,https://www.startsateight.com/christmas-activities/,http://www.aswewalkalongtheroad.com/2017/11/literature-activities-for-the-nutcracker.html,The Nutcracker,37,88,False,False,False,True,False,False,False,False,2024-01-21,2025-04-04,False,False
22,Aleks+Math - Search Images,https://akam.bing.com/images/search?FORM=IRIBEP&q=Aleks%2BMath,http://www.aswewalkalongtheroad.com/2015/07/a-review-of-aleks-online-math-program.html,aswewalkalongtheroad.com,38,401,False,False,False,True,False,False,False,False,2024-10-23,2025-01-10,False,True
13,Adventures with Jude: Planning Your Homeschool High School - Independent Study Model,http://www.adventureswithjude.com/2015/06/planning-your-homeschool-high-school.html,http://www.aswewalkalongtheroad.com/2015/06/making-plans-for-homeschooling-through.html,Making Plans for Homeschooling Through High School,39,52,False,False,False,True,False,False,False,False,2025-03-21,2025-04-05,False,False
5,History for Homeschool High School Tapestry of Grace,https://ichoosejoy.org/why-we-changed-our-history-curriculum-for-homeschool-high-school-to-tapestry-of-grace/,http://www.aswewalkalongtheroad.com/search/label/high%20school,As We Walk Along the Road,43,28,False,False,False,True,False,False,False,False,2024-01-24,2025-01-07,False,False
8,Give us ...... - A Net in Time,https://anetintime.ca/give-us/,https://www.aswewalkalongtheroad.com/2018/01/homeschool-day-in-the-life.html,A Day in the Life of a Homeschooler: Expectation Vs. Reality,43,82,False,False,False,True,False,False,False,False,2024-02-02,2025-05-18,False,False
14,Cooking with Kids: A Collection of Ideas - HomeschoolingFinds.com,https://schoolhousereviewcrew.com/cooking-with-kids-ideas/,http://www.aswewalkalongtheroad.com/2015/09/cooking-with-kids-without-losing-your.html,Cooking With Kids Without Losing Your Mind,44,35,False,False,False,True,False,False,False,False,2024-07-15,2025-05-12,False,False
7,Complete Guide for Stay-at-Home Moms: Homeschooling Resources » The Stay-at-Home-Mom Survival Guide,https://thestay-at-home-momsurvivalguide.com/complete-guide-for-stay-at-home-moms-homeschooling/,http://www.aswewalkalongtheroad.com/2015/01/confession-it-doesnt-get-any-easier.html,Confession: It Doesn’t Get Any Easier,45,94,False,False,False,True,False,False,False,False,2023-12-12,2025-05-09,False,False
17,Home - Mount Hideaway Mysteries - Mount Hideaway Mysteries,https://www.mounthideaway.com/,https://www.aswewalkalongtheroad.com/2020/02/family-movie-about-homeschoolers.html,"""Watch a Homeschool Friendly Mystery for Your Next Family Movie Night""",47,2,False,False,False,True,False,False,False,False,2024-02-24,2025-03-02,False,True
5,How to use unit studies to simplify your homeschool - 4onemore,http://www.4onemore.com/unit-studies/,https://www.aswewalkalongtheroad.com/2018/06/explore-geography-with-five-country.html,Geography Five Country Unit Study,57,73,False,False,False,True,False,False,False,False,2024-12-30,2024-12-30,False,False
6,Footprints in the Butter: Lit-Based Education: How We Homeschool,http://www.debrabrinkman.com/2018/01/lit-based-education-how-we-homeschool.html,https://www.aswewalkalongtheroad.com/2018/01/homeschool-day-in-the-life.html,A Day in the Life of a Homeschooler: Expectation Vs. Reality,62,277,False,False,False,True,False,False,False,False,2024-01-08,2025-05-14,False,False
7,How to Teach Your Child a Subject You Don't Like - The Old Schoolhouse®,https://www.theoldschoolhouse.com/how-to-teach-your-child-a-subject-you-dont-like/,http://www.aswewalkalongtheroad.com/,As We Walk Along the Road.,63,81,False,False,False,True,False,False,False,False,2024-03-21,2025-03-20,False,False
15,Wonderfully Made: God's Story of Life from Conception to Birth,https://www.thinkingkidsblog.org/wonderfully-made-gods-story-of-life-from-conception-to-birth/,http://www.aswewalkalongtheroad.com/2016/04/review-of-wonderfully-made.html,As We Walk Along the Road,65,102,False,False,False,True,False,False,False,False,2024-10-19,2025-05-13,False,False
5,"Dr. Seuss’s Birthday Bash: Would you, could you, in your house? | Humility and Doxology",https://www.humilityanddoxology.com/dr-seuss-birthday-bash/,https://www.aswewalkalongtheroad.com/2020/01/dr-seuss-activities-for-preschool.html,40 Awesome Dr. Seuss Activities for Preschool and Early Learning,73,69,False,False,False,True,False,False,False,False,2024-03-21,2025-03-29,False,False
5,MYTEK LAB - Online Technology Learning,http://myteklab.com/,https://www.aswewalkalongtheroad.com/technology-education-for-homeschool/,As We Walk Along the Road,79,43,False,False,False,True,False,False,False,False,2024-03-16,2025-05-05,False,False
17,Special Ways to Celebrate Christmas in Your Homeschool - Rock Your Homeschool,https://rockyourhomeschool.net/celebrate-christmas/,https://www.aswewalkalongtheroad.com/2017/11/christmas-books-and-activities-for-kids.html,Five Days of Classic Christmas Books and Activities for Kids,95,119,False,False,False,True,False,False,False,False,2024-10-23,2025-04-21,False,False
5,How to homeschool successfully? - They Call Me Blessed,https://www.theycallmeblessed.org/homeschool-successfully/,http://www.aswewalkalongtheroad.com/,As We Walk Along the Road,95,75,False,False,False,True,False,False,False,False,2024-07-28,2025-05-15,False,False
15,"NL# 663: Enjoying Autumn; Learning from Nature (+ Free Online Ebooks, Unit Studies, Activities)",https://myemail-api.constantcontact.com/NL--663--Enjoying-Autumn--Learning-from-Nature----Free-Online-Ebooks--Unit-Studies--Activities-.html?aid=2q-reIHW_eE&soid=1101229843312,https://www.aswewalkalongtheroad.com/mega-list-of-fall-themed-unit-studies/,Mega List of Fall-Themed Unit Studies,97,5,False,False,False,True,False,False,False,False,2024-09-15,2025-04-08,False,False
8,6th Grade Reading List - Freedom Homeschooling,https://freedomhomeschooling.com/6th-grade-reading-list/,https://www.aswewalkalongtheroad.com/literature-unit-study-ideas-for-king-of/,As We Walk Along the Road,109,29,False,False,False,True,False,False,False,False,2024-10-28,2025-04-07,False,False
8,100+ Free Unit Studies For All Ages | It's a Mother Thing,https://www.amotherthing.com/the-ultimate-free-homeschool-guide/100-free-unit-studies-for-all-ages/,http://www.aswewalkalongtheroad.com/2015/10/literature-unit-study-ideas-for-charlie.html,Charlie & The Chocolate Factory Unit Study,122,45,False,False,False,True,False,False,False,False,2024-11-11,2025-04-29,False,False
8,Book Club for Kids,https://www.bookclubforkids.org/awards/press,http://www.aswewalkalongtheroad.com/2017/09/18-great-educational-podcasts-for-kids.html,As We Walk Along the Road,153,27,False,False,False,True,False,False,False,False,2024-01-24,2025-04-29,False,False
7,Help! How Do I Homeschool?,https://www.homeschoolcreations.net/help-how-do-i-homeschool/,https://www.aswewalkalongtheroad.com/2015/06/making-plans-for-homeschooling-through.htm,Making Plans for Homeschooling Through High School | As We Walk Along the Road,164,150,False,False,False,True,False,False,False,False,2024-01-11,2025-05-14,False,False
