Page ascore,Source title,Source url,Target url,Anchor,External links,Internal links,Nofollow,Sponsored,Ugc,Text,Frame,Form,Image,Sitewide,First seen,Last seen,New link,Lost link
7,Resources by Tim Guga on Insights for Professionals,https://www.insightsforprofessionals.com/authors/tim-guga,https://capiston.com/,capiston.com,6,23,False,False,False,True,False,False,False,False,2024-12-07,2025-05-18,False,False
9,"Tim Guga, Author at Addicted 2 Success",https://addicted2success.com/author/tim-guga/,http://capiston.com/,capiston.com,9,51,False,False,False,True,False,False,False,False,2024-12-05,2025-05-16,False,False
14,How Saying the Word NO Can Change Your Business Forever | HackerNoon,https://hackernoon.com/this-powerful-word-can-change-your-business-forever-9lg3uim,https://capiston.com/wordpress-seo/?ref=hackernoon.com,SEO,13,41,False,False,True,True,False,False,False,False,2024-10-11,2025-05-18,False,False
10,How to Handle Employee Performance Issues in a Remote Team,https://blog.clickmeeting.com/performance-issues-in-a-remote-team,https://capiston.com/best-work-from-home-jobs/,working from home,16,108,False,False,False,True,False,False,False,False,2024-08-09,2025-05-26,False,False
11,9 Types of Marketing Campaigns (With Examples) – Woorise Blog,https://woorise.com/blog/types-of-marketing-campaigns,https://capiston.com/why-your-awesome-blog-post-will-never-go-viral-and-7-things-you-can-do-to-change-the-narrative/,nice piece by Tim from Capiston,18,77,False,False,False,True,False,False,False,False,2024-12-18,2025-05-22,False,False
7,Performing Beta Testing for Software Development - zipBoard,https://zipboard.co/blog/bug-tracking/beta-testing-software-development/,https://capiston.com/wordpress-seo/,solid SEO,22,147,False,False,False,True,False,False,False,False,2024-08-20,2025-05-17,False,False
11,Reviews: Benefits - Ezoic,https://wp.ezoic.com/reviews-benefits/,https://capiston.com/ezoic-review/,Ezoic Review – What is Ezoic and How Can it Help Me,24,50,False,False,False,True,False,False,False,False,2024-10-01,2025-05-05,False,False
7,Team Collaboration: Strategies for Remote Team Efficiency,https://www.timeneye.com/blog/team-collaboration-remote,https://capiston.com/best-work-from-home-jobs/,plenty of other options,24,73,False,False,False,True,False,False,False,False,2024-09-01,2025-05-12,False,False
15,Who Hires Copywriters? Tips for Getting Copywriting Clients,https://millo.co/who-hires-copywriters,https://capiston.com/websites-that-pay-you-to-write/,get paid to write,24,71,False,False,False,True,False,False,False,False,2025-05-03,2025-05-03,True,False
12,How to turn your company story into your greatest marketing tool,https://keap.com/small-business-automation-blog/marketing/branding/how-to-turn-your-company-story-into-your-greatest-marketing-tool,https://capiston.com/why-your-awesome-blog-post-will-never-go-viral-and-7-things-you-can-do-to-change-the-narrative/,quality content that connects with your audience,25,127,False,False,False,True,False,False,False,False,2024-11-02,2025-05-13,False,False
8,How to Boost WordPress Site Dwell Time,https://www.wpexplorer.com/boost-wordpress-dwell-time/,https://capiston.com/how-to-start-a-blog/,your blog,26,27,False,False,False,True,False,False,False,False,2024-08-22,2025-05-31,False,False
10,7 Tips for Building Landing Pages that Convert to Ticket Sales - Purplepass,https://devpp.purplepass.com/blog/7-tips-for-building-landing-pages-that-convert-to-ticket-sales/,https://capiston.com/how-to-start-a-blog/,blog posts,27,65,False,False,False,True,False,False,False,False,2024-09-09,2025-05-16,False,False
8,How to Attract and Convert Event Attendees to Leads - DivvyHQ,https://divvyhq.com/tips-how-tos/how-to-attract-and-convert-event-attendees-to-leads/,http://capiston.com/,capiston.com,27,51,False,False,False,True,False,False,False,False,2024-04-23,2025-04-04,False,True
10,5 Ways to create conversion-centered email designs,https://chamaileon.io/resources/conversion-centered-design/,https://capiston.com/how-to-start-a-blog/?ref=chamaileon.io,sending readers to your blog,27,75,False,False,False,True,False,False,False,False,2025-03-02,2025-05-26,False,False
8,9 Ways Online Businesses Can Provide A Better Customer Experience | Tars Blog,https://hellotars.com/blog/tactics-improving-customer-experience,https://capiston.com/how-to-start-a-blog/,how to start a blog,28,68,False,False,False,True,False,False,False,False,2024-11-01,2025-05-29,False,False
14,6 CRO Tactics to Utilize on Your eCommerce Store - Flippa,https://flippa.com/blog/6-cro-tactics-to-utilize-on-your-ecommerce-store/,https://capiston.com/how-to-start-a-blog/,growing your audience,28,140,False,False,False,True,False,False,False,False,2024-09-04,2025-04-19,False,False
12,7 Ways Working from Home Has Made Businesses Better for It - Thrive Global,https://community.thriveglobal.com/7-ways-working-from-home-has-made-businesses-better-for-it/,https://capiston.com/how-to-start-a-blog/,use blogging to grow,30,41,False,False,False,True,False,False,False,False,2025-01-17,2025-03-02,False,False
12,How positive brand image converts to customer loyalty - Agility PR Solutions,https://www.agilitypr.com/pr-news/public-relations/how-positive-brand-image-converts-to-customer-loyalty/,https://capiston.com/wordpress-seo/,search engine optimization,31,70,False,False,False,True,False,False,False,False,2024-11-03,2025-03-14,False,False
11,Five tips to maximize profits as an affiliate marketer - Search Engine Watch,https://www.searchenginewatch.com/2021/02/04/five-tips-to-maximize-profits-as-an-affiliate-marketer/,https://capiston.com/how-to-start-a-blog/,new blog,31,96,False,False,False,True,False,False,False,False,2024-09-11,2025-03-31,False,False
7,9 Jenis Marketing Campaign Terbaik - IDS | BTEC,https://idseducation.com/9-jenis-marketing-campaign-terbaik-untuk-promosikan-bisnis/,https://capiston.com/why-your-awesome-blog-post-will-never-go-viral-and-7-things-you-can-do-to-change-the-narrative/,Piston,31,62,False,False,False,True,False,False,False,False,2024-10-29,2025-05-25,False,False
5,Five tips to maximize profits as an affiliate marketer - purshoLOGY,https://www.purshology.com/2021/02/five-tips-to-maximize-profits-as-an-affiliate-marketer/,https://capiston.com/how-to-start-a-blog/,new blog,32,88,False,False,False,True,False,False,False,False,2024-08-29,2025-05-27,False,False
6,Como aumentar o tempo de permanência do site WordPress | Somos a FULL.,https://full.services/como-aumentar-o-tempo-de-permanencia-site-wordpress/,https://capiston.com/how-to-start-a-blog/,seu blog,37,40,False,False,False,True,False,False,False,False,2024-09-28,2025-05-27,False,False
11,How Businesses can use Facebook Marketplace to Increase Sales,https://www.datafeedwatch.com/blog/facebook-marketplace,https://capiston.com/how-to-start-a-blog/,your blog,46,72,False,False,False,True,False,False,False,False,2024-08-25,2025-05-29,False,False
11,Utilizing Micro-Conversions to Reel in Potential Customers,https://blog.shift4shop.com/micro-conversions,https://capiston.com/how-to-start-a-blog/,starting a blog,63,39,False,False,False,True,False,False,False,False,2024-09-05,2025-05-29,False,False
