Page ascore,Source title,Source url,Target url,Anchor,External links,Internal links,Nofollow,Sponsored,Ugc,Text,Frame,Form,Image,Sitewide,First seen,Last seen,New link,Lost link
5,Briard Mudi Mix | Shop for your Cause | Shop for your Cause,https://www.shopforyourcause.com/dog-breed/briard/mudi/mix,http://www.briardrescue.com/,Briard Rescue,7,23,False,False,False,True,False,False,False,False,2025-02-27,2025-05-29,False,False
5,Briard Neapolitan Mastiff Mix | Shop for your Cause | Shop for your Cause,https://www.shopforyourcause.com/dog-breed/briard/neapolitan-mastiff/mix,http://www.briardrescue.com/,Briard Rescue,7,23,False,False,False,True,False,False,False,False,2025-02-28,2025-05-26,False,False
5,Briard Nederlandse Kooikerhondje Mix | Shop for your Cause | Shop for your Cause,https://www.shopforyourcause.com/dog-breed/briard/nederlandse-kooikerhondje/mix,http://www.briardrescue.com/,Briard Rescue,7,23,False,False,False,True,False,False,False,False,2025-03-02,2025-05-29,False,False
5,Briard Newfoundland Mix | Shop for your Cause | Shop for your Cause,https://www.shopforyourcause.com/dog-breed/briard/newfoundland/mix,http://www.briardrescue.com/,Briard Rescue,7,23,False,False,False,True,False,False,False,False,2025-03-02,2025-05-28,False,False
5,Briard Norfolk Terrier Mix | Shop for your Cause | Shop for your Cause,https://www.shopforyourcause.com/dog-breed/briard/norfolk-terrier/mix,http://www.briardrescue.com/,Briard Rescue,7,23,False,False,False,True,False,False,False,False,2025-02-28,2025-05-26,False,False
5,Briard Norrbottenspets Mix | Shop for your Cause | Shop for your Cause,https://www.shopforyourcause.com/dog-breed/briard/norrbottenspets/mix,http://www.briardrescue.com/,Briard Rescue,7,23,False,False,False,True,False,False,False,False,2025-02-26,2025-05-22,False,False
5,Briard Norwegian Buhund Mix | Shop for your Cause | Shop for your Cause,https://www.shopforyourcause.com/dog-breed/briard/norwegian-buhund/mix,http://www.briardrescue.com/,Briard Rescue,7,23,False,False,False,True,False,False,False,False,2025-02-28,2025-05-26,False,False
5,Briard Norwegian Elkhound Mix | Shop for your Cause | Shop for your Cause,https://www.shopforyourcause.com/dog-breed/briard/norwegian-elkhound/mix,http://www.briardrescue.com/,Briard Rescue,7,23,False,False,False,True,False,False,False,False,2025-03-03,2025-05-29,False,False
5,Briard Norwegian Lundehund Mix | Shop for your Cause | Shop for your Cause,https://www.shopforyourcause.com/dog-breed/briard/norwegian-lundehund/mix,http://www.briardrescue.com/,Briard Rescue,7,23,False,False,False,True,False,False,False,False,2025-02-28,2025-05-26,False,False
5,Briard Norwich Terrier Mix | Shop for your Cause | Shop for your Cause,https://www.shopforyourcause.com/dog-breed/briard/norwich-terrier/mix,http://www.briardrescue.com/,Briard Rescue,7,23,False,False,False,True,False,False,False,False,2025-02-27,2025-05-24,False,False
5,Briard Nova Scotia Duck Tolling Retriever Mix | Shop for your Cause | Shop for your Cause,https://www.shopforyourcause.com/dog-breed/briard/nova-scotia-duck-tolling-retriever/mix,http://www.briardrescue.com/,Briard Rescue,7,23,False,False,False,True,False,False,False,False,2025-03-01,2025-05-28,False,False
5,Briard Old English Sheepdog Mix | Shop for your Cause | Shop for your Cause,https://www.shopforyourcause.com/dog-breed/briard/old-english-sheepdog/mix,http://www.briardrescue.com/,Briard Rescue,7,23,False,False,False,True,False,False,False,False,2025-02-26,2025-05-23,False,False
5,Briard Otterhound Mix | Shop for your Cause | Shop for your Cause,https://www.shopforyourcause.com/dog-breed/briard/otterhound/mix,http://www.briardrescue.com/,Briard Rescue,7,23,False,False,False,True,False,False,False,False,2025-02-27,2025-05-26,False,False
5,Briard Papillon Mix | Shop for your Cause | Shop for your Cause,https://www.shopforyourcause.com/dog-breed/briard/papillon/mix,http://www.briardrescue.com/,Briard Rescue,7,23,False,False,False,True,False,False,False,False,2025-03-02,2025-05-31,False,False
5,Briard Parson Russell Terrier Mix | Shop for your Cause | Shop for your Cause,https://www.shopforyourcause.com/dog-breed/briard/parson-russell-terrier/mix,http://www.briardrescue.com/,Briard Rescue,7,23,False,False,False,True,False,False,False,False,2025-02-27,2025-05-25,False,False
5,Briard Pekingese Mix | Shop for your Cause | Shop for your Cause,https://www.shopforyourcause.com/dog-breed/briard/pekingese/mix,http://www.briardrescue.com/,Briard Rescue,7,23,False,False,False,True,False,False,False,False,2025-02-26,2025-05-24,False,False
5,Briard Pembroke Welsh Corgi Mix | Shop for your Cause | Shop for your Cause,https://www.shopforyourcause.com/dog-breed/briard/pembroke-welsh-corgi/mix,http://www.briardrescue.com/,Briard Rescue,7,23,False,False,False,True,False,False,False,False,2025-03-02,2025-05-28,False,False
5,Briard Perro de Presa Canario Mix | Shop for your Cause | Shop for your Cause,https://www.shopforyourcause.com/dog-breed/briard/perro-de-presa-canario/mix,http://www.briardrescue.com/,Briard Rescue,7,23,False,False,False,True,False,False,False,False,2025-03-02,2025-05-28,False,False
5,Briard Peruvian Inca Orchid Mix | Shop for your Cause | Shop for your Cause,https://www.shopforyourcause.com/dog-breed/briard/peruvian-inca-orchid/mix,http://www.briardrescue.com/,Briard Rescue,7,23,False,False,False,True,False,False,False,False,2025-02-26,2025-05-24,False,False
5,Briard Petit Basset Griffon Vendéen Mix | Shop for your Cause | Shop for your Cause,https://www.shopforyourcause.com/dog-breed/briard/petit-basset-griffon-vend%C3%A9en/mix,http://www.briardrescue.com/,Briard Rescue,7,23,False,False,False,True,False,False,False,False,2025-03-02,2025-05-27,False,False
5,Briard Pharaoh Hound Mix | Shop for your Cause | Shop for your Cause,https://www.shopforyourcause.com/dog-breed/briard/pharaoh-hound/mix,http://www.briardrescue.com/,Briard Rescue,7,23,False,False,False,True,False,False,False,False,2025-02-28,2025-05-26,False,False
5,Briard Plott Hound Mix | Shop for your Cause | Shop for your Cause,https://www.shopforyourcause.com/dog-breed/briard/plott-hound/mix,http://www.briardrescue.com/,Briard Rescue,7,23,False,False,False,True,False,False,False,False,2025-02-27,2025-05-24,False,False
5,Briard Pointer Mix | Shop for your Cause | Shop for your Cause,https://www.shopforyourcause.com/dog-breed/briard/pointer/mix,http://www.briardrescue.com/,Briard Rescue,7,23,False,False,False,True,False,False,False,False,2025-02-26,2025-05-23,False,False
5,Briard Polish Lowland Sheepdog Mix | Shop for your Cause | Shop for your Cause,https://www.shopforyourcause.com/dog-breed/briard/polish-lowland-sheepdog/mix,http://www.briardrescue.com/,Briard Rescue,7,23,False,False,False,True,False,False,False,False,2025-03-02,2025-05-30,False,False
5,Briard Pomeranian Mix | Shop for your Cause | Shop for your Cause,https://www.shopforyourcause.com/dog-breed/briard/pomeranian/mix,http://www.briardrescue.com/,Briard Rescue,7,23,False,False,False,True,False,False,False,False,2025-02-27,2025-05-24,False,False
5,Briard Poodle (Miniature) Mix | Shop for your Cause | Shop for your Cause,https://www.shopforyourcause.com/dog-breed/briard/poodle-(miniature)/mix,http://www.briardrescue.com/,Briard Rescue,7,23,False,False,False,True,False,False,False,False,2025-02-27,2025-05-28,False,False
5,Briard Poodle (Standard) Mix | Shop for your Cause | Shop for your Cause,https://www.shopforyourcause.com/dog-breed/briard/poodle-(standard)/mix,http://www.briardrescue.com/,Briard Rescue,7,23,False,False,False,True,False,False,False,False,2025-02-27,2025-05-25,False,False
5,Briard Poodle (Toy) Mix | Shop for your Cause | Shop for your Cause,https://www.shopforyourcause.com/dog-breed/briard/poodle-(toy)/mix,http://www.briardrescue.com/,Briard Rescue,7,23,False,False,False,True,False,False,False,False,2025-03-02,2025-05-29,False,False
5,Briard Porcelaine Mix | Shop for your Cause | Shop for your Cause,https://www.shopforyourcause.com/dog-breed/briard/porcelaine/mix,http://www.briardrescue.com/,Briard Rescue,7,23,False,False,False,True,False,False,False,False,2025-03-02,2025-05-30,False,False
5,Briard Portuguese Podengo Pequeno Mix | Shop for your Cause | Shop for your Cause,https://www.shopforyourcause.com/dog-breed/briard/portuguese-podengo-pequeno/mix,http://www.briardrescue.com/,Briard Rescue,7,23,False,False,False,True,False,False,False,False,2025-02-27,2025-05-25,False,False
5,Briard Portuguese Pointer Mix | Shop for your Cause | Shop for your Cause,https://www.shopforyourcause.com/dog-breed/briard/portuguese-pointer/mix,http://www.briardrescue.com/,Briard Rescue,7,23,False,False,False,True,False,False,False,False,2025-02-27,2025-05-26,False,False
5,Briard Portuguese Sheepdog Mix | Shop for your Cause | Shop for your Cause,https://www.shopforyourcause.com/dog-breed/briard/portuguese-sheepdog/mix,http://www.briardrescue.com/,Briard Rescue,7,23,False,False,False,True,False,False,False,False,2025-02-27,2025-05-24,False,False
5,Briard Portuguese Water Dog Mix | Shop for your Cause | Shop for your Cause,https://www.shopforyourcause.com/dog-breed/briard/portuguese-water-dog/mix,http://www.briardrescue.com/,Briard Rescue,7,23,False,False,False,True,False,False,False,False,2025-02-27,2025-05-25,False,False
5,Briard Pudelpointer Mix | Shop for your Cause | Shop for your Cause,https://www.shopforyourcause.com/dog-breed/briard/pudelpointer/mix,http://www.briardrescue.com/,Briard Rescue,7,23,False,False,False,True,False,False,False,False,2025-02-26,2025-05-23,False,False
5,Briard Pug Mix | Shop for your Cause | Shop for your Cause,https://www.shopforyourcause.com/dog-breed/briard/pug/mix,http://www.briardrescue.com/,Briard Rescue,7,23,False,False,False,True,False,False,False,False,2025-02-26,2025-05-24,False,False
5,Briard Puli Mix | Shop for your Cause | Shop for your Cause,https://www.shopforyourcause.com/dog-breed/briard/puli/mix,http://www.briardrescue.com/,Briard Rescue,7,23,False,False,False,True,False,False,False,False,2025-02-27,2025-05-25,False,False
5,Briard Pumi Mix | Shop for your Cause | Shop for your Cause,https://www.shopforyourcause.com/dog-breed/briard/pumi/mix,http://www.briardrescue.com/,Briard Rescue,7,23,False,False,False,True,False,False,False,False,2025-02-27,2025-05-26,False,False
5,Briard Pyrenean Mastiff Mix | Shop for your Cause | Shop for your Cause,https://www.shopforyourcause.com/dog-breed/briard/pyrenean-mastiff/mix,http://www.briardrescue.com/,Briard Rescue,7,23,False,False,False,True,False,False,False,False,2025-03-01,2025-05-31,False,False
5,Briard Pyrenean Shepherd Mix | Shop for your Cause | Shop for your Cause,https://www.shopforyourcause.com/dog-breed/briard/pyrenean-shepherd/mix,http://www.briardrescue.com/,Briard Rescue,7,23,False,False,False,True,False,False,False,False,2025-03-02,2025-05-30,False,False
5,Briard Rafeiro do Alentejo Mix | Shop for your Cause | Shop for your Cause,https://www.shopforyourcause.com/dog-breed/briard/rafeiro-do-alentejo/mix,http://www.briardrescue.com/,Briard Rescue,7,23,False,False,False,True,False,False,False,False,2025-02-27,2025-05-24,False,False
5,Briard Rat Terrier Mix | Shop for your Cause | Shop for your Cause,https://www.shopforyourcause.com/dog-breed/briard/rat-terrier/mix,http://www.briardrescue.com/,Briard Rescue,7,23,False,False,False,True,False,False,False,False,2025-03-01,2025-05-27,False,False
5,Briard Redbone Coonhound Mix | Shop for your Cause | Shop for your Cause,https://www.shopforyourcause.com/dog-breed/briard/redbone-coonhound/mix,http://www.briardrescue.com/,Briard Rescue,7,23,False,False,False,True,False,False,False,False,2025-03-01,2025-05-27,False,False
5,Briard Rhodesian Ridgeback Mix | Shop for your Cause | Shop for your Cause,https://www.shopforyourcause.com/dog-breed/briard/rhodesian-ridgeback/mix,http://www.briardrescue.com/,Briard Rescue,7,23,False,False,False,True,False,False,False,False,2025-02-28,2025-05-26,False,False
5,Briard Romanian Mioritic Shepherd Dog Mix | Shop for your Cause | Shop for your Cause,https://www.shopforyourcause.com/dog-breed/briard/romanian-mioritic-shepherd-dog/mix,http://www.briardrescue.com/,Briard Rescue,7,23,False,False,False,True,False,False,False,False,2025-03-02,2025-05-30,False,False
5,Briard Rottweiler Mix | Shop for your Cause | Shop for your Cause,https://www.shopforyourcause.com/dog-breed/briard/rottweiler/mix,http://www.briardrescue.com/,Briard Rescue,7,23,False,False,False,True,False,False,False,False,2025-03-02,2025-05-28,False,False
5,Briard Russian Toy Terrier Mix | Shop for your Cause | Shop for your Cause,https://www.shopforyourcause.com/dog-breed/briard/russian-toy-terrier/mix,http://www.briardrescue.com/,Briard Rescue,7,23,False,False,False,True,False,False,False,False,2025-03-01,2025-05-27,False,False
5,Briard Russian Tsvetnaya Bolonka Mix | Shop for your Cause | Shop for your Cause,https://www.shopforyourcause.com/dog-breed/briard/russian-tsvetnaya-bolonka/mix,http://www.briardrescue.com/,Briard Rescue,7,23,False,False,False,True,False,False,False,False,2025-03-01,2025-05-30,False,False
5,Briard Saint Bernard Mix | Shop for your Cause | Shop for your Cause,https://www.shopforyourcause.com/dog-breed/briard/saint-bernard/mix,http://www.briardrescue.com/,Briard Rescue,7,23,False,False,False,True,False,False,False,False,2025-03-03,2025-05-30,False,False
5,Briard Saluki Mix | Shop for your Cause | Shop for your Cause,https://www.shopforyourcause.com/dog-breed/briard/saluki/mix,http://www.briardrescue.com/,Briard Rescue,7,23,False,False,False,True,False,False,False,False,2025-02-28,2025-05-25,False,False
5,Briard Samoyed Mix | Shop for your Cause | Shop for your Cause,https://www.shopforyourcause.com/dog-breed/briard/samoyed/mix,http://www.briardrescue.com/,Briard Rescue,7,23,False,False,False,True,False,False,False,False,2025-03-01,2025-05-27,False,False
5,Briard Schapendoes Mix | Shop for your Cause | Shop for your Cause,https://www.shopforyourcause.com/dog-breed/briard/schapendoes/mix,http://www.briardrescue.com/,Briard Rescue,7,23,False,False,False,True,False,False,False,False,2025-03-01,2025-05-28,False,False
5,Briard Scottish Deerhound Mix | Shop for your Cause | Shop for your Cause,https://www.shopforyourcause.com/dog-breed/briard/scottish-deerhound/mix,http://www.briardrescue.com/,Briard Rescue,7,23,False,False,False,True,False,False,False,False,2025-03-01,2025-05-28,False,False
5,Briard Scottish Terrier Mix | Shop for your Cause | Shop for your Cause,https://www.shopforyourcause.com/dog-breed/briard/scottish-terrier/mix,http://www.briardrescue.com/,Briard Rescue,7,23,False,False,False,True,False,False,False,False,2025-03-01,2025-05-28,False,False
5,Briard Sealyham Terrier Mix | Shop for your Cause | Shop for your Cause,https://www.shopforyourcause.com/dog-breed/briard/sealyham-terrier/mix,http://www.briardrescue.com/,Briard Rescue,7,23,False,False,False,True,False,False,False,False,2025-02-28,2025-05-27,False,False
5,Briard Segugio Italiano Mix | Shop for your Cause | Shop for your Cause,https://www.shopforyourcause.com/dog-breed/briard/segugio-italiano/mix,http://www.briardrescue.com/,Briard Rescue,7,23,False,False,False,True,False,False,False,False,2025-02-28,2025-05-28,False,False
5,Briard Shetland Sheepdog - Sheltie Mix | Shop for your Cause | Shop for your Cause,https://www.shopforyourcause.com/dog-breed/briard/shetland-sheepdog_sheltie/mix,http://www.briardrescue.com/,Briard Rescue,7,23,False,False,False,True,False,False,False,False,2025-02-28,2025-05-26,False,False
5,Briard Shiba Inu Mix | Shop for your Cause | Shop for your Cause,https://www.shopforyourcause.com/dog-breed/briard/shiba-inu/mix,http://www.briardrescue.com/,Briard Rescue,7,23,False,False,False,True,False,False,False,False,2025-02-27,2025-05-24,False,False
5,Briard Shih Tzu Mix | Shop for your Cause | Shop for your Cause,https://www.shopforyourcause.com/dog-breed/briard/shih-tzu/mix,http://www.briardrescue.com/,Briard Rescue,7,23,False,False,False,True,False,False,False,False,2025-03-02,2025-05-28,False,False
5,Briard Shikoku Mix | Shop for your Cause | Shop for your Cause,https://www.shopforyourcause.com/dog-breed/briard/shikoku/mix,http://www.briardrescue.com/,Briard Rescue,7,23,False,False,False,True,False,False,False,False,2025-02-28,2025-05-26,False,False
5,Briard Siberian Husky Mix | Shop for your Cause | Shop for your Cause,https://www.shopforyourcause.com/dog-breed/briard/siberian-husky/mix,http://www.briardrescue.com/,Briard Rescue,7,23,False,False,False,True,False,False,False,False,2025-03-02,2025-05-30,False,False
5,Briard Silky Terrier Mix | Shop for your Cause | Shop for your Cause,https://www.shopforyourcause.com/dog-breed/briard/silky-terrier/mix,http://www.briardrescue.com/,Briard Rescue,7,23,False,False,False,True,False,False,False,False,2025-02-28,2025-05-26,False,False
5,Briard Skye Terrier Mix | Shop for your Cause | Shop for your Cause,https://www.shopforyourcause.com/dog-breed/briard/skye-terrier/mix,http://www.briardrescue.com/,Briard Rescue,7,23,False,False,False,True,False,False,False,False,2025-02-28,2025-05-26,False,False
5,Briard Sloughi Mix | Shop for your Cause | Shop for your Cause,https://www.shopforyourcause.com/dog-breed/briard/sloughi/mix,http://www.briardrescue.com/,Briard Rescue,7,23,False,False,False,True,False,False,False,False,2025-03-02,2025-05-28,False,False
5,Briard Slovakian Wirehaired Pointer Mix | Shop for your Cause | Shop for your Cause,https://www.shopforyourcause.com/dog-breed/briard/slovakian-wirehaired-pointer/mix,http://www.briardrescue.com/,Briard Rescue,7,23,False,False,False,True,False,False,False,False,2025-02-27,2025-05-24,False,False
5,Briard Slovensky Cuvac Mix | Shop for your Cause | Shop for your Cause,https://www.shopforyourcause.com/dog-breed/briard/slovensky-cuvac/mix,http://www.briardrescue.com/,Briard Rescue,7,23,False,False,False,True,False,False,False,False,2025-02-26,2025-05-23,False,False
5,Briard Slovensky Kopov Mix | Shop for your Cause | Shop for your Cause,https://www.shopforyourcause.com/dog-breed/briard/slovensky-kopov/mix,http://www.briardrescue.com/,Briard Rescue,7,23,False,False,False,True,False,False,False,False,2025-02-27,2025-05-25,False,False
5,Briard Smooth Fox Terrier Mix | Shop for your Cause | Shop for your Cause,https://www.shopforyourcause.com/dog-breed/briard/smooth-fox-terrier/mix,http://www.briardrescue.com/,Briard Rescue,7,23,False,False,False,True,False,False,False,False,2025-03-02,2025-05-29,False,False
5,Briard Soft Coated Wheaten Terrier Mix | Shop for your Cause | Shop for your Cause,https://www.shopforyourcause.com/dog-breed/briard/soft-coated-wheaten-terrier/mix,http://www.briardrescue.com/,Briard Rescue,7,23,False,False,False,True,False,False,False,False,2025-03-01,2025-05-29,False,False
5,Briard Spanish Mastiff Mix | Shop for your Cause | Shop for your Cause,https://www.shopforyourcause.com/dog-breed/briard/spanish-mastiff/mix,http://www.briardrescue.com/,Briard Rescue,7,23,False,False,False,True,False,False,False,False,2025-03-02,2025-05-29,False,False
5,Briard Spanish Water Dog Mix | Shop for your Cause | Shop for your Cause,https://www.shopforyourcause.com/dog-breed/briard/spanish-water-dog/mix,http://www.briardrescue.com/,Briard Rescue,7,23,False,False,False,True,False,False,False,False,2025-02-28,2025-05-28,False,False
5,Briard Spinone Italiano Mix | Shop for your Cause | Shop for your Cause,https://www.shopforyourcause.com/dog-breed/briard/spinone-italiano/mix,http://www.briardrescue.com/,Briard Rescue,7,23,False,False,False,True,False,False,False,False,2025-03-02,2025-05-29,False,False
5,Briard Stabyhoun Mix | Shop for your Cause | Shop for your Cause,https://www.shopforyourcause.com/dog-breed/briard/stabyhoun/mix,http://www.briardrescue.com/,Briard Rescue,7,23,False,False,False,True,False,False,False,False,2025-02-28,2025-05-26,False,False
5,Briard Staffordshire Bull Terrier Mix | Shop for your Cause | Shop for your Cause,https://www.shopforyourcause.com/dog-breed/briard/staffordshire-bull-terrier/mix,http://www.briardrescue.com/,Briard Rescue,7,23,False,False,False,True,False,False,False,False,2025-03-03,2025-05-30,False,False
5,Briard Standard Schnauzer Mix | Shop for your Cause | Shop for your Cause,https://www.shopforyourcause.com/dog-breed/briard/standard-schnauzer/mix,http://www.briardrescue.com/,Briard Rescue,7,23,False,False,False,True,False,False,False,False,2025-03-01,2025-05-26,False,False
5,Briard Sussex Spaniel Mix | Shop for your Cause | Shop for your Cause,https://www.shopforyourcause.com/dog-breed/briard/sussex-spaniel/mix,http://www.briardrescue.com/,Briard Rescue,7,23,False,False,False,True,False,False,False,False,2025-02-28,2025-05-26,False,False
5,Briard Swedish Lapphund Mix | Shop for your Cause | Shop for your Cause,https://www.shopforyourcause.com/dog-breed/briard/swedish-lapphund/mix,http://www.briardrescue.com/,Briard Rescue,7,23,False,False,False,True,False,False,False,False,2025-02-28,2025-05-26,False,False
5,Briard Swedish Vallhund Mix | Shop for your Cause | Shop for your Cause,https://www.shopforyourcause.com/dog-breed/briard/swedish-vallhund/mix,http://www.briardrescue.com/,Briard Rescue,7,23,False,False,False,True,False,False,False,False,2025-03-02,2025-05-30,False,False
5,Briard Taiwan Dog Mix | Shop for your Cause | Shop for your Cause,https://www.shopforyourcause.com/dog-breed/briard/taiwan-dog/mix,http://www.briardrescue.com/,Briard Rescue,7,23,False,False,False,True,False,False,False,False,2025-02-28,2025-05-26,False,False
5,Briard Teddy Roosevelt Terrier Mix | Shop for your Cause | Shop for your Cause,https://www.shopforyourcause.com/dog-breed/briard/teddy-roosevelt-terrier/mix,http://www.briardrescue.com/,Briard Rescue,7,23,False,False,False,True,False,False,False,False,2025-03-01,2025-05-28,False,False
5,Briard Thai Ridgeback Mix | Shop for your Cause | Shop for your Cause,https://www.shopforyourcause.com/dog-breed/briard/thai-ridgeback/mix,http://www.briardrescue.com/,Briard Rescue,7,23,False,False,False,True,False,False,False,False,2025-03-01,2025-05-29,False,False
5,Briard Tibetan Mastiff Mix | Shop for your Cause | Shop for your Cause,https://www.shopforyourcause.com/dog-breed/briard/tibetan-mastiff/mix,http://www.briardrescue.com/,Briard Rescue,7,23,False,False,False,True,False,False,False,False,2025-02-27,2025-05-28,False,False
5,Briard Tibetan Spaniel Mix | Shop for your Cause | Shop for your Cause,https://www.shopforyourcause.com/dog-breed/briard/tibetan-spaniel/mix,http://www.briardrescue.com/,Briard Rescue,7,23,False,False,False,True,False,False,False,False,2025-02-28,2025-05-27,False,False
5,Briard Tibetan Terrier Mix | Shop for your Cause | Shop for your Cause,https://www.shopforyourcause.com/dog-breed/briard/tibetan-terrier/mix,http://www.briardrescue.com/,Briard Rescue,7,23,False,False,False,True,False,False,False,False,2025-02-28,2025-05-26,False,False
5,Briard Tornjak Mix | Shop for your Cause | Shop for your Cause,https://www.shopforyourcause.com/dog-breed/briard/tornjak/mix,http://www.briardrescue.com/,Briard Rescue,7,23,False,False,False,True,False,False,False,False,2025-03-03,2025-05-30,False,False
5,Briard Tosa Mix | Shop for your Cause | Shop for your Cause,https://www.shopforyourcause.com/dog-breed/briard/tosa/mix,http://www.briardrescue.com/,Briard Rescue,7,23,False,False,False,True,False,False,False,False,2025-02-27,2025-05-28,False,False
5,Briard Toy Fox Terrier Mix | Shop for your Cause | Shop for your Cause,https://www.shopforyourcause.com/dog-breed/briard/toy-fox-terrier/mix,http://www.briardrescue.com/,Briard Rescue,7,23,False,False,False,True,False,False,False,False,2025-02-27,2025-05-26,False,False
5,Briard Transylvanian Hound Mix | Shop for your Cause | Shop for your Cause,https://www.shopforyourcause.com/dog-breed/briard/transylvanian-hound/mix,http://www.briardrescue.com/,Briard Rescue,7,23,False,False,False,True,False,False,False,False,2025-03-02,2025-05-31,False,False
5,Briard Treeing Tennessee Brindle Mix | Shop for your Cause | Shop for your Cause,https://www.shopforyourcause.com/dog-breed/briard/treeing-tennessee-brindle/mix,http://www.briardrescue.com/,Briard Rescue,7,23,False,False,False,True,False,False,False,False,2025-02-28,2025-05-27,False,False
5,Briard Treeing Walker Coonhound Mix | Shop for your Cause | Shop for your Cause,https://www.shopforyourcause.com/dog-breed/briard/treeing-walker-coonhound/mix,http://www.briardrescue.com/,Briard Rescue,7,23,False,False,False,True,False,False,False,False,2025-02-26,2025-05-24,False,False
5,Briard Vizsla Mix | Shop for your Cause | Shop for your Cause,https://www.shopforyourcause.com/dog-breed/briard/vizsla/mix,http://www.briardrescue.com/,Briard Rescue,7,23,False,False,False,True,False,False,False,False,2025-02-26,2025-05-23,False,False
5,Briard Weimaraner Mix | Shop for your Cause | Shop for your Cause,https://www.shopforyourcause.com/dog-breed/briard/weimaraner/mix,http://www.briardrescue.com/,Briard Rescue,7,23,False,False,False,True,False,False,False,False,2025-03-02,2025-05-28,False,False
5,Briard Welsh Springer Spaniel Mix | Shop for your Cause | Shop for your Cause,https://www.shopforyourcause.com/dog-breed/briard/welsh-springer-spaniel/mix,http://www.briardrescue.com/,Briard Rescue,7,23,False,False,False,True,False,False,False,False,2025-03-01,2025-05-29,False,False
5,Briard Welsh Terrier Mix | Shop for your Cause | Shop for your Cause,https://www.shopforyourcause.com/dog-breed/briard/welsh-terrier/mix,http://www.briardrescue.com/,Briard Rescue,7,23,False,False,False,True,False,False,False,False,2025-03-03,2025-05-30,False,False
5,Briard West Highland White Terrier Mix | Shop for your Cause | Shop for your Cause,https://www.shopforyourcause.com/dog-breed/briard/west-highland-white-terrier/mix,http://www.briardrescue.com/,Briard Rescue,7,23,False,False,False,True,False,False,False,False,2025-02-27,2025-05-25,False,False
