Page ascore,Source title,Source url,Target url,Anchor,External links,Internal links,Nofollow,Sponsored,Ugc,Text,Frame,Form,Image,Sitewide,First seen,Last seen,New link,Lost link
5,Briard Maltese Mix | Shop for your Cause | Shop for your Cause,https://shopforyourcause.com/dog-breed/briard/maltese/mix,http://www.briardrescue.com/,Briard Rescue,7,23,False,False,False,True,False,False,False,False,2024-12-13,2025-05-20,False,False
5,Briard Manchester Terrier (Standard) Mix | Shop for your Cause | Shop for your Cause,https://shopforyourcause.com/dog-breed/briard/manchester-terrier-(standard)/mix,http://www.briardrescue.com/,Briard Rescue,7,23,False,False,False,True,False,False,False,False,2025-02-08,2025-05-28,False,False
5,Briard Manchester Terrier (Toy) Mix | Shop for your Cause | Shop for your Cause,https://shopforyourcause.com/dog-breed/briard/manchester-terrier-(toy)/mix,http://www.briardrescue.com/,Briard Rescue,7,23,False,False,False,True,False,False,False,False,2024-12-26,2025-05-29,False,False
5,Briard Mastiff Mix | Shop for your Cause | Shop for your Cause,https://shopforyourcause.com/dog-breed/briard/mastiff/mix,http://www.briardrescue.com/,Briard Rescue,7,23,False,False,False,True,False,False,False,False,2024-09-20,2025-05-27,False,False
5,Briard Miniature Pinscher Mix | Shop for your Cause | Shop for your Cause,https://shopforyourcause.com/dog-breed/briard/miniature-pinscher/mix,http://www.briardrescue.com/,Briard Rescue,7,23,False,False,False,True,False,False,False,False,2024-12-26,2025-05-22,False,False
5,Briard Mountain Cur Mix | Shop for your Cause | Shop for your Cause,https://shopforyourcause.com/dog-breed/briard/mountain-cur/mix,http://www.briardrescue.com/,Briard Rescue,7,23,False,False,False,True,False,False,False,False,2024-12-25,2025-05-27,False,False
5,Briard Mudi Mix | Shop for your Cause | Shop for your Cause,https://shopforyourcause.com/dog-breed/briard/mudi/mix,http://www.briardrescue.com/,Briard Rescue,7,23,False,False,False,True,False,False,False,False,2024-08-07,2025-05-28,False,False
5,Briard Nederlandse Kooikerhondje Mix | Shop for your Cause | Shop for your Cause,https://shopforyourcause.com/dog-breed/briard/nederlandse-kooikerhondje/mix,http://www.briardrescue.com/,Briard Rescue,7,23,False,False,False,True,False,False,False,False,2025-01-05,2025-05-24,False,False
5,Briard Newfoundland Mix | Shop for your Cause | Shop for your Cause,https://shopforyourcause.com/dog-breed/briard/newfoundland/mix,http://www.briardrescue.com/,Briard Rescue,7,23,False,False,False,True,False,False,False,False,2024-12-27,2025-05-30,False,False
5,Briard Norfolk Terrier Mix | Shop for your Cause | Shop for your Cause,https://shopforyourcause.com/dog-breed/briard/norfolk-terrier/mix,http://www.briardrescue.com/,Briard Rescue,7,23,False,False,False,True,False,False,False,False,2024-12-26,2025-05-31,False,False
5,Briard Norrbottenspets Mix | Shop for your Cause | Shop for your Cause,https://shopforyourcause.com/dog-breed/briard/norrbottenspets/mix,http://www.briardrescue.com/,Briard Rescue,7,23,False,False,False,True,False,False,False,False,2025-01-01,2025-05-22,False,False
5,Briard Norwegian Buhund Mix | Shop for your Cause | Shop for your Cause,https://shopforyourcause.com/dog-breed/briard/norwegian-buhund/mix,http://www.briardrescue.com/,Briard Rescue,7,23,False,False,False,True,False,False,False,False,2024-12-28,2025-05-24,False,False
5,Briard Norwegian Elkhound Mix | Shop for your Cause | Shop for your Cause,https://shopforyourcause.com/dog-breed/briard/norwegian-elkhound/mix,http://www.briardrescue.com/,Briard Rescue,7,23,False,False,False,True,False,False,False,False,2024-12-25,2025-05-26,False,False
5,Briard Norwegian Lundehund Mix | Shop for your Cause | Shop for your Cause,https://shopforyourcause.com/dog-breed/briard/norwegian-lundehund/mix,http://www.briardrescue.com/,Briard Rescue,7,23,False,False,False,True,False,False,False,False,2024-12-31,2025-05-23,False,False
5,Briard Norwich Terrier Mix | Shop for your Cause | Shop for your Cause,https://shopforyourcause.com/dog-breed/briard/norwich-terrier/mix,http://www.briardrescue.com/,Briard Rescue,7,23,False,False,False,True,False,False,False,False,2024-12-31,2025-05-22,False,False
5,Briard Otterhound Mix | Shop for your Cause | Shop for your Cause,https://shopforyourcause.com/dog-breed/briard/otterhound/mix,http://www.briardrescue.com/,Briard Rescue,7,23,False,False,False,True,False,False,False,False,2024-08-06,2025-05-26,False,False
5,Briard Papillon Mix | Shop for your Cause | Shop for your Cause,https://shopforyourcause.com/dog-breed/briard/papillon/mix,http://www.briardrescue.com/,Briard Rescue,7,23,False,False,False,True,False,False,False,False,2024-08-22,2025-05-30,False,False
5,Briard Pekingese Mix | Shop for your Cause | Shop for your Cause,https://shopforyourcause.com/dog-breed/briard/pekingese/mix,http://www.briardrescue.com/,Briard Rescue,7,23,False,False,False,True,False,False,False,False,2024-09-28,2025-05-23,False,False
5,Briard Pembroke Welsh Corgi Mix | Shop for your Cause | Shop for your Cause,https://shopforyourcause.com/dog-breed/briard/pembroke-welsh-corgi/mix,http://www.briardrescue.com/,Briard Rescue,7,23,False,False,False,True,False,False,False,False,2024-12-25,2025-05-25,False,False
5,Briard Petit Basset Griffon Vendéen Mix | Shop for your Cause | Shop for your Cause,https://shopforyourcause.com/dog-breed/briard/petit-basset-griffon-vend%C3%A9en/mix,http://www.briardrescue.com/,Briard Rescue,7,23,False,False,False,True,False,False,False,False,2025-01-21,2025-05-27,False,False
5,Briard Pointer Mix | Shop for your Cause | Shop for your Cause,https://shopforyourcause.com/dog-breed/briard/pointer/mix,http://www.briardrescue.com/,Briard Rescue,7,23,False,False,False,True,False,False,False,False,2024-08-08,2025-05-26,False,False
5,Briard Polish Lowland Sheepdog Mix | Shop for your Cause | Shop for your Cause,https://shopforyourcause.com/dog-breed/briard/polish-lowland-sheepdog/mix,http://www.briardrescue.com/,Briard Rescue,7,23,False,False,False,True,False,False,False,False,2024-12-25,2025-05-30,False,False
5,Briard Pomeranian Mix | Shop for your Cause | Shop for your Cause,https://shopforyourcause.com/dog-breed/briard/pomeranian/mix,http://www.briardrescue.com/,Briard Rescue,7,23,False,False,False,True,False,False,False,False,2024-08-09,2025-05-28,False,False
5,Briard Poodle (Toy) Mix | Shop for your Cause | Shop for your Cause,https://shopforyourcause.com/dog-breed/briard/poodle-(toy)/mix,http://www.briardrescue.com/,Briard Rescue,7,23,False,False,False,True,False,False,False,False,2025-01-16,2025-05-27,False,False
5,Briard Porcelaine Mix | Shop for your Cause | Shop for your Cause,https://shopforyourcause.com/dog-breed/briard/porcelaine/mix,http://www.briardrescue.com/,Briard Rescue,7,23,False,False,False,True,False,False,False,False,2024-12-26,2025-05-30,False,False
5,Briard Portuguese Sheepdog Mix | Shop for your Cause | Shop for your Cause,https://shopforyourcause.com/dog-breed/briard/portuguese-sheepdog/mix,http://www.briardrescue.com/,Briard Rescue,7,23,False,False,False,True,False,False,False,False,2024-12-29,2025-05-25,False,False
5,Briard Pug Mix | Shop for your Cause | Shop for your Cause,https://shopforyourcause.com/dog-breed/briard/pug/mix,http://www.briardrescue.com/,Briard Rescue,7,23,False,False,False,True,False,False,False,False,2024-08-10,2025-05-29,False,False
5,Briard Puli Mix | Shop for your Cause | Shop for your Cause,https://shopforyourcause.com/dog-breed/briard/puli/mix,http://www.briardrescue.com/,Briard Rescue,7,23,False,False,False,True,False,False,False,False,2024-07-27,2025-05-29,False,False
5,Briard Pumi Mix | Shop for your Cause | Shop for your Cause,https://shopforyourcause.com/dog-breed/briard/pumi/mix,http://www.briardrescue.com/,Briard Rescue,7,23,False,False,False,True,False,False,False,False,2024-08-21,2025-05-29,False,False
5,Briard Rafeiro do Alentejo Mix | Shop for your Cause | Shop for your Cause,https://shopforyourcause.com/dog-breed/briard/rafeiro-do-alentejo/mix,http://www.briardrescue.com/,Briard Rescue,7,23,False,False,False,True,False,False,False,False,2024-12-25,2025-05-31,False,False
5,Briard Rat Terrier Mix | Shop for your Cause | Shop for your Cause,https://shopforyourcause.com/dog-breed/briard/rat-terrier/mix,http://www.briardrescue.com/,Briard Rescue,7,23,False,False,False,True,False,False,False,False,2024-12-30,2025-05-21,False,False
5,Briard Rhodesian Ridgeback Mix | Shop for your Cause | Shop for your Cause,https://shopforyourcause.com/dog-breed/briard/rhodesian-ridgeback/mix,http://www.briardrescue.com/,Briard Rescue,7,23,False,False,False,True,False,False,False,False,2024-12-28,2025-05-23,False,False
5,Briard Rottweiler Mix | Shop for your Cause | Shop for your Cause,https://shopforyourcause.com/dog-breed/briard/rottweiler/mix,http://www.briardrescue.com/,Briard Rescue,7,23,False,False,False,True,False,False,False,False,2024-08-06,2025-05-30,False,False
5,Briard Russian Toy Terrier Mix | Shop for your Cause | Shop for your Cause,https://shopforyourcause.com/dog-breed/briard/russian-toy-terrier/mix,http://www.briardrescue.com/,Briard Rescue,7,23,False,False,False,True,False,False,False,False,2025-01-14,2025-05-26,False,False
5,Briard Russian Tsvetnaya Bolonka Mix | Shop for your Cause | Shop for your Cause,https://shopforyourcause.com/dog-breed/briard/russian-tsvetnaya-bolonka/mix,http://www.briardrescue.com/,Briard Rescue,7,23,False,False,False,True,False,False,False,False,2025-01-04,2025-05-24,False,False
5,Briard Saint Bernard Mix | Shop for your Cause | Shop for your Cause,https://shopforyourcause.com/dog-breed/briard/saint-bernard/mix,http://www.briardrescue.com/,Briard Rescue,7,23,False,False,False,True,False,False,False,False,2024-12-29,2025-05-22,False,False
5,Briard Saluki Mix | Shop for your Cause | Shop for your Cause,https://shopforyourcause.com/dog-breed/briard/saluki/mix,http://www.briardrescue.com/,Briard Rescue,7,23,False,False,False,True,False,False,False,False,2024-12-16,2025-05-28,False,False
5,Briard Samoyed Mix | Shop for your Cause | Shop for your Cause,https://shopforyourcause.com/dog-breed/briard/samoyed/mix,http://www.briardrescue.com/,Briard Rescue,7,23,False,False,False,True,False,False,False,False,2024-07-28,2025-05-27,False,False
5,Briard Schipperke Mix | Shop for your Cause | Shop for your Cause,https://shopforyourcause.com/dog-breed/briard/schipperke/mix,http://www.briardrescue.com/,Briard Rescue,7,23,False,False,False,True,False,False,False,False,2024-12-30,2025-05-25,False,False
5,Briard Scottish Deerhound Mix | Shop for your Cause | Shop for your Cause,https://shopforyourcause.com/dog-breed/briard/scottish-deerhound/mix,http://www.briardrescue.com/,Briard Rescue,7,23,False,False,False,True,False,False,False,False,2025-01-23,2025-05-27,False,False
5,Briard Sealyham Terrier Mix | Shop for your Cause | Shop for your Cause,https://shopforyourcause.com/dog-breed/briard/sealyham-terrier/mix,http://www.briardrescue.com/,Briard Rescue,7,23,False,False,False,True,False,False,False,False,2024-12-31,2025-05-22,False,False
5,Briard Shetland Sheepdog - Sheltie Mix | Shop for your Cause | Shop for your Cause,https://shopforyourcause.com/dog-breed/briard/shetland-sheepdog_sheltie/mix,http://www.briardrescue.com/,Briard Rescue,7,23,False,False,False,True,False,False,False,False,2024-12-25,2025-05-31,False,False
5,Briard Shiba Inu Mix | Shop for your Cause | Shop for your Cause,https://shopforyourcause.com/dog-breed/briard/shiba-inu/mix,http://www.briardrescue.com/,Briard Rescue,7,23,False,False,False,True,False,False,False,False,2024-09-09,2025-05-28,False,False
5,Briard Shih Tzu Mix | Shop for your Cause | Shop for your Cause,https://shopforyourcause.com/dog-breed/briard/shih-tzu/mix,http://www.briardrescue.com/,Briard Rescue,7,23,False,False,False,True,False,False,False,False,2024-12-15,2025-05-29,False,False
5,Briard Shikoku Mix | Shop for your Cause | Shop for your Cause,https://shopforyourcause.com/dog-breed/briard/shikoku/mix,http://www.briardrescue.com/,Briard Rescue,7,23,False,False,False,True,False,False,False,False,2024-08-23,2025-05-28,False,False
5,Briard Siberian Husky Mix | Shop for your Cause | Shop for your Cause,https://shopforyourcause.com/dog-breed/briard/siberian-husky/mix,http://www.briardrescue.com/,Briard Rescue,7,23,False,False,False,True,False,False,False,False,2024-12-25,2025-05-25,False,False
5,Briard Silky Terrier Mix | Shop for your Cause | Shop for your Cause,https://shopforyourcause.com/dog-breed/briard/silky-terrier/mix,http://www.briardrescue.com/,Briard Rescue,7,23,False,False,False,True,False,False,False,False,2024-12-25,2025-05-26,False,False
5,Briard Skye Terrier Mix | Shop for your Cause | Shop for your Cause,https://shopforyourcause.com/dog-breed/briard/skye-terrier/mix,http://www.briardrescue.com/,Briard Rescue,7,23,False,False,False,True,False,False,False,False,2025-01-26,2025-05-28,False,False
5,Briard Sloughi Mix | Shop for your Cause | Shop for your Cause,https://shopforyourcause.com/dog-breed/briard/sloughi/mix,http://www.briardrescue.com/,Briard Rescue,7,23,False,False,False,True,False,False,False,False,2024-07-31,2025-05-28,False,False
5,Briard Slovakian Wirehaired Pointer Mix | Shop for your Cause | Shop for your Cause,https://shopforyourcause.com/dog-breed/briard/slovakian-wirehaired-pointer/mix,http://www.briardrescue.com/,Briard Rescue,7,23,False,False,False,True,False,False,False,False,2024-12-27,2025-05-24,False,False
5,Briard Small Munsterlander Mix | Shop for your Cause | Shop for your Cause,https://shopforyourcause.com/dog-breed/briard/small-munsterlander/mix,http://www.briardrescue.com/,Briard Rescue,7,23,False,False,False,True,False,False,False,False,2025-01-03,2025-05-27,False,False
5,Briard Smooth Fox Terrier Mix | Shop for your Cause | Shop for your Cause,https://shopforyourcause.com/dog-breed/briard/smooth-fox-terrier/mix,http://www.briardrescue.com/,Briard Rescue,7,23,False,False,False,True,False,False,False,False,2024-12-29,2025-05-22,False,False
5,Briard Soft Coated Wheaten Terrier Mix | Shop for your Cause | Shop for your Cause,https://shopforyourcause.com/dog-breed/briard/soft-coated-wheaten-terrier/mix,http://www.briardrescue.com/,Briard Rescue,7,23,False,False,False,True,False,False,False,False,2024-12-25,2025-05-27,False,False
5,Briard Spanish Mastiff Mix | Shop for your Cause | Shop for your Cause,https://shopforyourcause.com/dog-breed/briard/spanish-mastiff/mix,http://www.briardrescue.com/,Briard Rescue,7,23,False,False,False,True,False,False,False,False,2024-12-25,2025-05-25,False,False
5,Briard Spanish Water Dog Mix | Shop for your Cause | Shop for your Cause,https://shopforyourcause.com/dog-breed/briard/spanish-water-dog/mix,http://www.briardrescue.com/,Briard Rescue,7,23,False,False,False,True,False,False,False,False,2024-12-31,2025-05-25,False,False
5,Briard Spinone Italiano Mix | Shop for your Cause | Shop for your Cause,https://shopforyourcause.com/dog-breed/briard/spinone-italiano/mix,http://www.briardrescue.com/,Briard Rescue,7,23,False,False,False,True,False,False,False,False,2025-01-31,2025-05-27,False,False
5,Briard Stabyhoun Mix | Shop for your Cause | Shop for your Cause,https://shopforyourcause.com/dog-breed/briard/stabyhoun/mix,http://www.briardrescue.com/,Briard Rescue,7,23,False,False,False,True,False,False,False,False,2024-08-05,2025-05-29,False,False
5,Briard Staffordshire Bull Terrier Mix | Shop for your Cause | Shop for your Cause,https://shopforyourcause.com/dog-breed/briard/staffordshire-bull-terrier/mix,http://www.briardrescue.com/,Briard Rescue,7,23,False,False,False,True,False,False,False,False,2024-12-25,2025-05-27,False,False
5,Briard Standard Schnauzer Mix | Shop for your Cause | Shop for your Cause,https://shopforyourcause.com/dog-breed/briard/standard-schnauzer/mix,http://www.briardrescue.com/,Briard Rescue,7,23,False,False,False,True,False,False,False,False,2025-01-04,2025-05-26,False,False
5,Briard Swedish Lapphund Mix | Shop for your Cause | Shop for your Cause,https://shopforyourcause.com/dog-breed/briard/swedish-lapphund/mix,http://www.briardrescue.com/,Briard Rescue,7,23,False,False,False,True,False,False,False,False,2025-01-02,2025-05-26,False,False
5,Briard Swedish Vallhund Mix | Shop for your Cause | Shop for your Cause,https://shopforyourcause.com/dog-breed/briard/swedish-vallhund/mix,http://www.briardrescue.com/,Briard Rescue,7,23,False,False,False,True,False,False,False,False,2024-12-29,2025-05-26,False,False
5,Briard Taiwan Dog Mix | Shop for your Cause | Shop for your Cause,https://shopforyourcause.com/dog-breed/briard/taiwan-dog/mix,http://www.briardrescue.com/,Briard Rescue,7,23,False,False,False,True,False,False,False,False,2024-09-07,2025-05-28,False,False
5,Briard Thai Ridgeback Mix | Shop for your Cause | Shop for your Cause,https://shopforyourcause.com/dog-breed/briard/thai-ridgeback/mix,http://www.briardrescue.com/,Briard Rescue,7,23,False,False,False,True,False,False,False,False,2025-01-02,2025-05-23,False,False
5,Briard Tibetan Mastiff Mix | Shop for your Cause | Shop for your Cause,https://shopforyourcause.com/dog-breed/briard/tibetan-mastiff/mix,http://www.briardrescue.com/,Briard Rescue,7,23,False,False,False,True,False,False,False,False,2024-12-25,2025-05-26,False,False
5,Briard Tibetan Spaniel Mix | Shop for your Cause | Shop for your Cause,https://shopforyourcause.com/dog-breed/briard/tibetan-spaniel/mix,http://www.briardrescue.com/,Briard Rescue,7,23,False,False,False,True,False,False,False,False,2024-12-28,2025-05-22,False,False
5,Briard Tornjak Mix | Shop for your Cause | Shop for your Cause,https://shopforyourcause.com/dog-breed/briard/tornjak/mix,http://www.briardrescue.com/,Briard Rescue,7,23,False,False,False,True,False,False,False,False,2024-09-20,2025-05-30,False,False
5,Briard Tosa Mix | Shop for your Cause | Shop for your Cause,https://shopforyourcause.com/dog-breed/briard/tosa/mix,http://www.briardrescue.com/,Briard Rescue,7,23,False,False,False,True,False,False,False,False,2024-11-22,2025-05-27,False,False
5,Briard Vizsla Mix | Shop for your Cause | Shop for your Cause,https://shopforyourcause.com/dog-breed/briard/vizsla/mix,http://www.briardrescue.com/,Briard Rescue,7,23,False,False,False,True,False,False,False,False,2024-08-03,2025-05-29,False,False
5,Briard Weimaraner Mix | Shop for your Cause | Shop for your Cause,https://shopforyourcause.com/dog-breed/briard/weimaraner/mix,http://www.briardrescue.com/,Briard Rescue,7,23,False,False,False,True,False,False,False,False,2024-09-19,2025-05-27,False,False
5,Briard Welsh Springer Spaniel Mix | Shop for your Cause | Shop for your Cause,https://shopforyourcause.com/dog-breed/briard/welsh-springer-spaniel/mix,http://www.briardrescue.com/,Briard Rescue,7,23,False,False,False,True,False,False,False,False,2024-12-29,2025-05-22,False,False
5,Briard West Highland White Terrier Mix | Shop for your Cause | Shop for your Cause,https://shopforyourcause.com/dog-breed/briard/west-highland-white-terrier/mix,http://www.briardrescue.com/,Briard Rescue,7,23,False,False,False,True,False,False,False,False,2025-01-02,2025-05-27,False,False
5,Briard Wetterhoun - Frisian Water Dog Mix | Shop for your Cause | Shop for your Cause,https://shopforyourcause.com/dog-breed/briard/wetterhoun_frisian-water-dog/mix,http://www.briardrescue.com/,Briard Rescue,7,23,False,False,False,True,False,False,False,False,2024-12-26,2025-05-26,False,False
5,Briard Whippet Mix | Shop for your Cause | Shop for your Cause,https://shopforyourcause.com/dog-breed/briard/whippet/mix,http://www.briardrescue.com/,Briard Rescue,7,23,False,False,False,True,False,False,False,False,2024-07-31,2025-05-28,False,False
5,Briard Wirehaired Pointing Griffon Mix | Shop for your Cause | Shop for your Cause,https://shopforyourcause.com/dog-breed/briard/wirehaired-pointing-griffon/mix,http://www.briardrescue.com/,Briard Rescue,7,23,False,False,False,True,False,False,False,False,2024-12-25,2025-05-25,False,False
5,Briard Wolf Mix | Shop for your Cause | Shop for your Cause,https://shopforyourcause.com/dog-breed/briard/wolf/mix,http://www.briardrescue.com/,Briard Rescue,7,23,False,False,False,True,False,False,False,False,2024-08-21,2025-05-28,False,False
5,Briard Xoloitzcuintli Mix | Shop for your Cause | Shop for your Cause,https://shopforyourcause.com/dog-breed/briard/xoloitzcuintli/mix,http://www.briardrescue.com/,Briard Rescue,7,23,False,False,False,True,False,False,False,False,2024-12-30,2025-05-24,False,False
5,Briard Yakutian Laika Mix | Shop for your Cause | Shop for your Cause,https://shopforyourcause.com/dog-breed/briard/yakutian-laika/mix,http://www.briardrescue.com/,Briard Rescue,7,23,False,False,False,True,False,False,False,False,2024-12-25,2025-05-27,False,False
5,Briard Yorkshire Terrier Mix | Shop for your Cause | Shop for your Cause,https://shopforyourcause.com/dog-breed/briard/yorkshire-terrier/mix,http://www.briardrescue.com/,Briard Rescue,7,23,False,False,False,True,False,False,False,False,2024-12-25,2025-05-31,False,False
5,Briard Brittany Mix | Shop for your Cause | Shop for your Cause,https://www.shopforyourcause.com/dog-breed/briard/brittany/mix,http://www.briardrescue.com/,Briard Rescue,7,23,False,False,False,True,False,False,False,False,2025-02-28,2025-05-26,False,False
5,Briard Broholmer - Danish Mastiff Mix | Shop for your Cause | Shop for your Cause,https://www.shopforyourcause.com/dog-breed/briard/broholmer_danish-mastiff/mix,http://www.briardrescue.com/,Briard Rescue,7,23,False,False,False,True,False,False,False,False,2025-03-02,2025-05-28,False,False
5,Briard Brussels Griffon Mix | Shop for your Cause | Shop for your Cause,https://www.shopforyourcause.com/dog-breed/briard/brussels-griffon/mix,http://www.briardrescue.com/,Briard Rescue,7,23,False,False,False,True,False,False,False,False,2025-02-26,2025-05-24,False,False
5,Briard Bull Terrier Mix | Shop for your Cause | Shop for your Cause,https://www.shopforyourcause.com/dog-breed/briard/bull-terrier/mix,http://www.briardrescue.com/,Briard Rescue,7,23,False,False,False,True,False,False,False,False,2025-02-28,2025-05-25,False,False
5,Briard Bulldog Mix | Shop for your Cause | Shop for your Cause,https://www.shopforyourcause.com/dog-breed/briard/bulldog/mix,http://www.briardrescue.com/,Briard Rescue,7,23,False,False,False,True,False,False,False,False,2025-02-28,2025-05-27,False,False
5,Briard Bullmastiff Mix | Shop for your Cause | Shop for your Cause,https://www.shopforyourcause.com/dog-breed/briard/bullmastiff/mix,http://www.briardrescue.com/,Briard Rescue,7,23,False,False,False,True,False,False,False,False,2025-03-02,2025-05-29,False,False
5,Briard Cairn Terrier Mix | Shop for your Cause | Shop for your Cause,https://www.shopforyourcause.com/dog-breed/briard/cairn-terrier/mix,http://www.briardrescue.com/,Briard Rescue,7,23,False,False,False,True,False,False,False,False,2025-03-01,2025-05-28,False,False
5,Briard Canaan Dog Mix | Shop for your Cause | Shop for your Cause,https://www.shopforyourcause.com/dog-breed/briard/canaan-dog/mix,http://www.briardrescue.com/,Briard Rescue,7,23,False,False,False,True,False,False,False,False,2025-02-28,2025-05-26,False,False
5,Briard Cane Corso Mix | Shop for your Cause | Shop for your Cause,https://www.shopforyourcause.com/dog-breed/briard/cane-corso/mix,http://www.briardrescue.com/,Briard Rescue,7,23,False,False,False,True,False,False,False,False,2025-03-02,2025-05-28,False,False
5,Briard Cardigan Welsh Corgi Mix | Shop for your Cause | Shop for your Cause,https://www.shopforyourcause.com/dog-breed/briard/cardigan-welsh-corgi/mix,http://www.briardrescue.com/,Briard Rescue,7,23,False,False,False,True,False,False,False,False,2025-03-03,2025-05-30,False,False
5,Briard Carolina Dog - American Dingo Mix | Shop for your Cause | Shop for your Cause,https://www.shopforyourcause.com/dog-breed/briard/carolina-dog_american-dingo/mix,http://www.briardrescue.com/,Briard Rescue,7,23,False,False,False,True,False,False,False,False,2025-03-01,2025-05-30,False,False
5,Briard Catahoula Leopard Dog Mix | Shop for your Cause | Shop for your Cause,https://www.shopforyourcause.com/dog-breed/briard/catahoula-leopard-dog/mix,http://www.briardrescue.com/,Briard Rescue,7,23,False,False,False,True,False,False,False,False,2025-02-26,2025-05-23,False,False
5,Briard Caucasian Shepherd Dog Mix | Shop for your Cause | Shop for your Cause,https://www.shopforyourcause.com/dog-breed/briard/caucasian-shepherd-dog/mix,http://www.briardrescue.com/,Briard Rescue,7,23,False,False,False,True,False,False,False,False,2025-02-27,2025-05-24,False,False
5,Briard Cavalier King Charles Spaniel Mix | Shop for your Cause | Shop for your Cause,https://www.shopforyourcause.com/dog-breed/briard/cavalier-king-charles-spaniel/mix,http://www.briardrescue.com/,Briard Rescue,7,23,False,False,False,True,False,False,False,False,2025-03-02,2025-05-29,False,False
5,Briard Central Asian Shepherd Dog Mix | Shop for your Cause | Shop for your Cause,https://www.shopforyourcause.com/dog-breed/briard/central-asian-shepherd-dog/mix,http://www.briardrescue.com/,Briard Rescue,7,23,False,False,False,True,False,False,False,False,2025-03-01,2025-05-27,False,False
5,Briard Cesky Terrier Mix | Shop for your Cause | Shop for your Cause,https://www.shopforyourcause.com/dog-breed/briard/cesky-terrier/mix,http://www.briardrescue.com/,Briard Rescue,7,23,False,False,False,True,False,False,False,False,2025-02-27,2025-05-24,False,False
5,Briard Chesapeake Bay Retriever Mix | Shop for your Cause | Shop for your Cause,https://www.shopforyourcause.com/dog-breed/briard/chesapeake-bay-retriever/mix,http://www.briardrescue.com/,Briard Rescue,7,23,False,False,False,True,False,False,False,False,2025-03-01,2025-05-27,False,False
5,Briard Chihuahua Mix | Shop for your Cause | Shop for your Cause,https://www.shopforyourcause.com/dog-breed/briard/chihuahua/mix,http://www.briardrescue.com/,Briard Rescue,7,23,False,False,False,True,False,False,False,False,2025-02-28,2025-05-26,False,False
